{"activation":"eager","catalog":{"blurb":"Save website usernames and passwords once; the agent fills them into the right site when you say log in.","tags":["credentials","browser","login"],"title":"Website logins"},"categories":["identity","browser"],"cliCommands":[],"configGroups":[],"configSchema":{"additionalProperties":false,"properties":{},"type":"object"},"contracts":{"channels":[],"routes":{"mountPath":"/api/credentials","paths":["/","/:id","/:id/login","/login-auto"]},"tools":["browser_login"],"webSearchProviders":[]},"dashboard":{"actionVerbs":[],"dataBindings":[{"description":"Number of saved website logins (metadata only).","name":"account_count","paramShape":{"additionalProperties":false,"properties":{},"type":"object"}}]},"description":"Encrypted website logins, filled worker-side into the agent browser. Each login is locked to its domain; a fill on any other domain is refused.","doctorContract":{"configRepair":{"dropUnknownKeys":true},"stateMigrations":[]},"enabledByDefault":true,"id":"credentials","name":"Website logins","skills":[],"toolMetadata":{"browser_login":{"description":"Sign a browser session in with a saved login. Approval comes from the user's own log-in words or an owner approval.","kind":"both","providedBy":"direct","requiresApproval":true}},"version":"1.0.0","writeOnly":[]}